<?xml version="1.0" encoding="UTF-8" ?>
<inventory xmlns="http://org.pp.mybatis/schema/inventory"
           xmlns:xsi="http://www.w3.org/2001/XMLSchema-instance"
           xsi:schemaLocation="http://org.pp.mybatis/schema/inventory inventory.xsd"
>
    <book year="2000">
        <title>Snow Crash</title>
        <author>Neal Stephenson</author>
        <publisher>Spectra</publisher>
        <isbn>0553380958</isbn>
        <price>14.95</price>
    </book>
    <book year="2005">
        <title>Burning Tower</title>
        <author>Larry Niven</author>
        <author>Jerry Pournelle</author>
        <publisher>Pocket</publisher>
        <isbn>0743416910</isbn>
        <price>5.99</price>
    </book>
    <book year="1995">
        <title>Zodiac</title>
        <author>Neal Stephenson</author>
        <publisher>Spectra</publisher>
        <isbn>0553573862</isbn>
        <price>7.50</price>
    </book>
</inventory>